{
  "manifest_version": "SR-EXECUTION.v0.1.0",
  "receipt_id": "RCPT-000039",
  "decision": "ACCEPTED",
  "submission_identity": "SR-OBJ-000033",
  "submission_hash": "sha256:610943105c56f6dda21cfe648206ac0e6d965da87a911b5eb64d696ad9b43574",
  "submission_snapshot_path": "receipts/accepted/RCPT-000039.submission.json",
  "engine_revision": "f7bb7eb87aebf1aec667da616a0fb24274af111b",
  "schema_version": "SR-SCHEMA.v0.4.0",
  "taxonomy_version": "SR-TAXONOMY.v0.2.0",
  "registry_base": "f7bb7eb87aebf1aec667da616a0fb24274af111b",
  "evaluated_at": "2026-09-26T19:47:34Z",
  "gate_results": {
    "A": "PASS",
    "B": "PASS",
    "C": "PASS",
    "D": "PASS",
    "E": "PASS",
    "F": "PASS",
    "G": "PASS"
  },
  "route": "cli",
  "operation_key": "2026-09-new-papers-hm-admission",
  "source_files": [
    {
      "display_name": "39-How_Much_of_a_Thing_Must_Remain_the_Same_v1_0_DOI_22952262.pdf",
      "sha256": "ad7776017918fc62fb9181e092e7fa66629f58895a9aac067a11bc86af72c2fa",
      "bytes": 159069,
      "media_type": null,
      "version_reference": null,
      "public": false
    }
  ],
  "review_decision": null
}
